{
  "version": "1.0.0",
  "name": "Kyle McCormick",
  "title": "Software Engineer",
  "oneLiner": "Modern web applications, developer tools, and generative AI.",
  "siteUrl": "https://kpm.fyi",
  "sshAddress": "https://ssh.kpm.fyi",
  "sourceRepo": "https://github.com/buntingszn/terminal-portfolio"
}
